item_id,title,price,currency_id,condition,available_quantity,seller_id,seller_reputation,location,url
MLA1919533810,Auriculares Jbl Intraurales Con Cable Tune 310c Usb-c Negro,34999,ARS,new,484,1530116762,No Reputation,Buenos Aires,https://articulo.mercadolibre.com.ar/MLA-1919533810-auriculares-jbl-intraurales-con-cable-tune-310c-usb-c-negro-_JM
MLA1422152591,Auriculares Manos Libres Para Samsung 100% Originales,10914,ARS,new,886,162278948,No Reputation,Capital Federal,https://articulo.mercadolibre.com.ar/MLA-1422152591-auriculares-manos-libres-para-samsung-100-originales-_JM
MLA1290995916,Auriculares Samsung 3.5mm Earphones In Ear Negro Ia500,12499,ARS,new,14112,577646081,No Reputation,Buenos Aires,https://articulo.mercadolibre.com.ar/MLA-1290995916-auriculares-samsung-35mm-earphones-in-ear-negro-ia500-_JM
MLA1404273137,Auriculares Sony Super Bass Color Negro,40698,ARS,new,224,247639927,No Reputation,Buenos Aires,https://articulo.mercadolibre.com.ar/MLA-1404273137-auriculares-sony-super-bass-color-negro-_JM
MLA1592259292,Auriculares Soul S389 Manos Libres Micrófono Celular 3.5mm Color Negro,3560.0,ARS,new,137,51303810,No Reputation,Buenos Aires,https://articulo.mercadolibre.com.ar/MLA-1592259292-auriculares-soul-s389-manos-libres-microfono-celular-35mm-color-negro-_JM
MLA1469328015,Auriculares In-ear Samsung Tuned By Akg Eo-ig955 Black,24526,ARS,new,43,636146938,No Reputation,Capital Federal,https://articulo.mercadolibre.com.ar/MLA-1469328015-auriculares-in-ear-samsung-tuned-by-akg-eo-ig955-black-_JM
MLA1746648390,Auriculares Inalambricos Samsung Galaxy Buds Fe Color Graphite 30hs,139999,ARS,new,200,1673359714,No Reputation,Capital Federal,https://articulo.mercadolibre.com.ar/MLA-1746648390-auriculares-inalambricos-samsung-galaxy-buds-fe-color-graphite-30hs-_JM
MLA1470429571,"Reloj Inteligente Samsung Fit 3 Dark Gray Pantalla Amoled 1,6  Bateria 13 Días Ritmo Cardiaco 256mb Bluetooth 5.3",84999,ARS,new,98,262582139,No Reputation,Capital Federal,https://articulo.mercadolibre.com.ar/MLA-1470429571-reloj-inteligente-samsung-fit-3-dark-gray-pantalla-amoled-16-bateria-13-dias-ritmo-cardiaco-256mb-bluetooth-53-_JM
MLA1993332052,Auriculares Samsung Galaxy Buds 3 Pro Gray Ai,414999,ARS,new,6,1673359714,No Reputation,Capital Federal,https://articulo.mercadolibre.com.ar/MLA-1993332052-auriculares-samsung-galaxy-buds-3-pro-gray-ai-_JM
MLA1880488224,Auriculares Qcy Pro Manos Libres Bluetooth Samsung LG Sony Color Negro,25999,ARS,new,10024,37133205,No Reputation,Capital Federal,https://articulo.mercadolibre.com.ar/MLA-1880488224-auriculares-qcy-pro-manos-libres-bluetooth-samsung-lg-sony-color-negro-_JM
MLA1972300196,Auriculares In-ear Samsung Akg  Eo-ic100 Eo-ic100bbegww Negro,24000,ARS,new,91,5846919,No Reputation,Capital Federal,https://articulo.mercadolibre.com.ar/MLA-1972300196-auriculares-in-ear-samsung-akg-eo-ic100-eo-ic100bbegww-negro-_JM
MLA1470413571,Auriculares Bluetooth F9 Tws 4hs De Musica + Power Bank Color Blanco,7650,ARS,new,246,261534699,No Reputation,Capital Federal,https://articulo.mercadolibre.com.ar/MLA-1470413571-auriculares-bluetooth-f9-tws-4hs-de-musica-power-bank-color-blanco-_JM
MLA1746634774,Auriculares Samsung Galaxy Buds2 Pro  Sm-r510 Anc Bluetooth 5.3 Ipx7 Color Graphite,239999,ARS,new,137,1673359714,No Reputation,Capital Federal,https://articulo.mercadolibre.com.ar/MLA-1746634774-auriculares-samsung-galaxy-buds2-pro-sm-r510-anc-bluetooth-53-ipx7-color-graphite-_JM
MLA1414032483,Auricular De Cable Con Micrófono Manos Libres Para Samsung ,7999,ARS,new,407,1573355060,No Reputation,Capital Federal,https://articulo.mercadolibre.com.ar/MLA-1414032483-auricular-de-cable-con-microfono-manos-libres-para-samsung-_JM
MLA1576249438,Auriculares Inalambricos Para iPhone/samsung - Sport J92,39780,ARS,new,436,1416601148,No Reputation,Capital Federal,https://articulo.mercadolibre.com.ar/MLA-1576249438-auriculares-inalambricos-para-iphonesamsung-sport-j92-_JM
MLA1438769891,Auriculares In-ear Qkz Ak6 Pro Microfono Color Verde Cable Desmontable,39999,ARS,new,24,1294871881,No Reputation,Capital Federal,https://articulo.mercadolibre.com.ar/MLA-1438769891-auriculares-in-ear-qkz-ak6-pro-microfono-color-verde-cable-desmontable-_JM
MLA1470449387,Samsung Galaxy Fit3 Pink Gold 1.6 Amoled Caja Blanco Malla Rosa Bisel Rosa Diseño De La Malla Sport,114999,ARS,new,65,172753273,No Reputation,Buenos Aires,https://articulo.mercadolibre.com.ar/MLA-1470449387-samsung-galaxy-fit3-pink-gold-16-amoled-caja-blanco-malla-rosa-bisel-rosa-diseno-de-la-malla-sport-_JM
MLA1972772854,Auriculares In-ear Para Samsung A14 A24 A04e A12 A04 A11 A13,8990,ARS,new,234,420301340,No Reputation,Capital Federal,https://articulo.mercadolibre.com.ar/MLA-1972772854-auriculares-in-ear-para-samsung-a14-a24-a04e-a12-a04-a11-a13-_JM
MLA1147599339,Auricular Inalambrico Bluetooth 5.0 Xaea  Motorola Samsung ,56000,ARS,new,335,292238139,No Reputation,Capital Federal,https://articulo.mercadolibre.com.ar/MLA-1147599339-auricular-inalambrico-bluetooth-50-xaea-motorola-samsung-_JM
MLA1975409942,Auriculares Inalámbricos Bluetooth Soul Hero Beats Bt400 Color Negro,25222,ARS,new,60,62264510,No Reputation,Entre Ríos,https://articulo.mercadolibre.com.ar/MLA-1975409942-auriculares-inalambricos-bluetooth-soul-hero-beats-bt400-color-negro-_JM
MLA1688439846,Auriculares Inalambricos Compatibles Con iPhone Xiaom Samsun,29990,ARS,new,777,1093572823,No Reputation,Córdoba,https://articulo.mercadolibre.com.ar/MLA-1688439846-auriculares-inalambricos-compatibles-con-iphone-xiaom-samsun-_JM
MLA1642612184,Auricular Inalámbrico Samsung Galaxy Buds Fe Grafito,228999,ARS,new,178,287440338,No Reputation,Buenos Aires,https://articulo.mercadolibre.com.ar/MLA-1642612184-auricular-inalambrico-samsung-galaxy-buds-fe-grafito-_JM
MLA2004492688,Auricular Inalámbrico Samsung Galaxy Buds 3 Pro Gray Ai,440999,ARS,new,52,172753273,No Reputation,Buenos Aires,https://articulo.mercadolibre.com.ar/MLA-2004492688-auricular-inalambrico-samsung-galaxy-buds-3-pro-gray-ai-_JM
MLA1457608029,Auriculares Stereo Usb Tipo C Compatible Con Samsung Moto Color Negro,4704,ARS,new,59,2064115616,No Reputation,Capital Federal,https://articulo.mercadolibre.com.ar/MLA-1457608029-auriculares-stereo-usb-tipo-c-compatible-con-samsung-moto-color-negro-_JM
MLA1473750973,Auriculares Baseus Encok H06 3.5mm Cableado Color Negro,19990,ARS,new,1,284824585,No Reputation,Capital Federal,https://articulo.mercadolibre.com.ar/MLA-1473750973-auriculares-baseus-encok-h06-35mm-cableado-color-negro-_JM
MLA1432474611,Auriculares Manos Libres Usb Tipo C Para Samsung S23+ Otros,9890,ARS,new,120,32212593,No Reputation,Capital Federal,https://articulo.mercadolibre.com.ar/MLA-1432474611-auriculares-manos-libres-usb-tipo-c-para-samsung-s23-otros-_JM
MLA1951597928,Auriculares In-ear Inalámbricos Samsung Galaxy  Buds+ Sm-r175nz Negro Con Luz Led,195340,ARS,new,3,47756131,No Reputation,Santa Fe,https://articulo.mercadolibre.com.ar/MLA-1951597928-auriculares-in-ear-inalambricos-samsung-galaxy-buds-sm-r175nz-negro-con-luz-led-_JM
MLA1751895114,Auriculares Samsung Galaxy Buds2 Pro Anc Bluetooth 5.3 Ipx7 Color White,297000.0,ARS,new,69,146480022,No Reputation,Capital Federal,https://articulo.mercadolibre.com.ar/MLA-1751895114-auriculares-samsung-galaxy-buds2-pro-anc-bluetooth-53-ipx7-color-white-_JM
MLA1429456807,"Auriculares Intraurales Samsung Ehs61asfwe, Color Negro",3341,ARS,new,1471,250338078,No Reputation,Buenos Aires,https://articulo.mercadolibre.com.ar/MLA-1429456807-auriculares-intraurales-samsung-ehs61asfwe-color-negro-_JM
MLA1437774203,Tablet Samsung Galaxy Tab A9+ 8gb Ram 128gb 11 PuLG Plata Color Plateado,973399.0,ARS,new,47,146480022,No Reputation,Capital Federal,https://articulo.mercadolibre.com.ar/MLA-1437774203-tablet-samsung-galaxy-tab-a9-8gb-ram-128gb-11-pulg-plata-color-plateado-_JM
MLA1452989995,Samsung Galaxy Buds 3 Auriculares Bluetooth Color Negro,316999,ARS,new,40,287440338,No Reputation,Buenos Aires,https://articulo.mercadolibre.com.ar/MLA-1452989995-samsung-galaxy-buds-3-auriculares-bluetooth-color-negro-_JM
MLA1428071755,Auricular Compatible Samsung S20 S21 A33 A53 A54 Tipo C Color Blanco,5435,ARS,new,243,438008873,No Reputation,Capital Federal,https://articulo.mercadolibre.com.ar/MLA-1428071755-auricular-compatible-samsung-s20-s21-a33-a53-a54-tipo-c-color-blanco-_JM
MLA1524492802,Auriculares In-ear Samsung Tuned By Akg White,61999,ARS,new,75,1143772690,No Reputation,Capital Federal,https://articulo.mercadolibre.com.ar/MLA-1524492802-auriculares-in-ear-samsung-tuned-by-akg-white-_JM
MLA1400539735,Auriculares Deportivos Bluetooth Para Motorola Moto G52 Color Negro Color De La Luz Rojo,6330,ARS,new,140,352981908,No Reputation,Capital Federal,https://articulo.mercadolibre.com.ar/MLA-1400539735-auriculares-deportivos-bluetooth-para-motorola-moto-g52-color-negro-color-de-la-luz-rojo-_JM
MLA1918225248,Auriculares Tipo C Para Samsung A15 A25 A35 A55 Blanco,6999,ARS,new,80,77540700,No Reputation,Capital Federal,https://articulo.mercadolibre.com.ar/MLA-1918225248-auriculares-tipo-c-para-samsung-a15-a25-a35-a55-blanco-_JM
MLA1579015886,Auriculares Manos Libres Para Samsung Akg S10 S8 S9 ,13999,ARS,new,788,138396008,No Reputation,Buenos Aires,https://articulo.mercadolibre.com.ar/MLA-1579015886-auriculares-manos-libres-para-samsung-akg-s10-s8-s9-_JM
MLA1440004451,Auricular Samsung Galaxy Buds3 Gray Color Sm- R530,359900.0,ARS,new,10,301908357,No Reputation,Capital Federal,https://articulo.mercadolibre.com.ar/MLA-1440004451-auricular-samsung-galaxy-buds3-gray-color-sm-r530-_JM
MLA1460058287,Auriculares Tipo C Para Samsung S21 S22 S23 S24 A35 A55,7899,ARS,new,38,84640737,No Reputation,Buenos Aires,https://articulo.mercadolibre.com.ar/MLA-1460058287-auriculares-tipo-c-para-samsung-s21-s22-s23-s24-a35-a55-_JM
MLA1462640171,Audifonos Manos Libres Samsung Ia500 3.5mm Negro,22999,ARS,new,44,1143772690,No Reputation,Capital Federal,https://articulo.mercadolibre.com.ar/MLA-1462640171-audifonos-manos-libres-samsung-ia500-35mm-negro-_JM
MLA2000607950,Auricular Manos Libres Bluetooth Soul Tws 1000 C/ Microfono Color Blanco,15751,ARS,new,10,116021253,No Reputation,Buenos Aires,https://articulo.mercadolibre.com.ar/MLA-2000607950-auricular-manos-libres-bluetooth-soul-tws-1000-c-microfono-color-blanco-_JM
MLA1982821004,"Audifono Samsung Galaxy Buds Fe Sm-r400, Bluetooth Blanco Color White Color De La Luz Azul",129999,ARS,new,3,1473497418,No Reputation,Santa Fe,https://articulo.mercadolibre.com.ar/MLA-1982821004-audifono-samsung-galaxy-buds-fe-sm-r400-bluetooth-blanco-color-white-color-de-la-luz-azul-_JM
MLA1463971213,Pack X4 Unidades De Auriculares Para Samsung 100% Originales,33011,ARS,new,26,162278948,No Reputation,Capital Federal,https://articulo.mercadolibre.com.ar/MLA-1463971213-pack-x4-unidades-de-auriculares-para-samsung-100-originales-_JM
MLA1382030749,Auriculares Samsung Type-c Earphones,21193.22,ARS,new,241,172753273,No Reputation,Buenos Aires,https://articulo.mercadolibre.com.ar/MLA-1382030749-auriculares-samsung-type-c-earphones-_JM
MLA1943143428,Auriculares Samsung Type-c Color Blanco,26803.19,ARS,new,73,452287402,No Reputation,Buenos Aires,https://articulo.mercadolibre.com.ar/MLA-1943143428-auriculares-samsung-type-c-color-blanco-_JM
MLA1422629429,Auriculares In-ear Gamer Tws  F9-5 Blanco Con Luz Led,7999,ARS,new,910,1342741163,No Reputation,Capital Federal,https://articulo.mercadolibre.com.ar/MLA-1422629429-auriculares-in-ear-gamer-tws-f9-5-blanco-con-luz-led-_JM
MLA1623811654,Auriculares Soul S389 Manos Libres In Ear Blanco O Negro Color Rojo,3560.0,ARS,new,58,161619180,No Reputation,Buenos Aires,https://articulo.mercadolibre.com.ar/MLA-1623811654-auriculares-soul-s389-manos-libres-in-ear-blanco-o-negro-color-rojo-_JM
MLA1251622959,Auriculares Deportivos Bluetooth Sport Para Samsung A53 5g,6330,ARS,new,556,352981908,No Reputation,Capital Federal,https://articulo.mercadolibre.com.ar/MLA-1251622959-auriculares-deportivos-bluetooth-sport-para-samsung-a53-5g-_JM
MLA1473711671,Samsung Galaxy Buds3 Color Gray,316999,ARS,new,269,172753273,No Reputation,Buenos Aires,https://articulo.mercadolibre.com.ar/MLA-1473711671-samsung-galaxy-buds3-color-gray-_JM
MLA1991470842,Auriculares Samsung Galaxy Buds Fe White,128921,ARS,new,4,2197229328,No Reputation,Buenos Aires,https://articulo.mercadolibre.com.ar/MLA-1991470842-auriculares-samsung-galaxy-buds-fe-white-_JM
MLA1452862581,Auriculares Para Samsung Manos Libres A03 A13 A14 A24 A04,7999,ARS,new,49,36187978,No Reputation,Capital Federal,https://articulo.mercadolibre.com.ar/MLA-1452862581-auriculares-para-samsung-manos-libres-a03-a13-a14-a24-a04-_JM
MLA1473937353,Auriculares Samsung Galaxy Buds 3 Pro Gray Ai,440999,ARS,new,102,172753273,No Reputation,Buenos Aires,https://articulo.mercadolibre.com.ar/MLA-1473937353-auriculares-samsung-galaxy-buds-3-pro-gray-ai-_JM
MLA1426345657,Auricular Para Samsung Galaxy S22 Con Cable Entrada Usb-c Color Blanco,8999,ARS,new,687,1239654169,No Reputation,Capital Federal,https://articulo.mercadolibre.com.ar/MLA-1426345657-auricular-para-samsung-galaxy-s22-con-cable-entrada-usb-c-color-blanco-_JM
MLA1462849061,Auriculares Pro Bluetooth Inalambricos Para iPhone Samsung,22999,ARS,new,26,36187978,No Reputation,Capital Federal,https://articulo.mercadolibre.com.ar/MLA-1462849061-auriculares-pro-bluetooth-inalambricos-para-iphone-samsung-_JM
MLA1799083974,Auriculares Manos Libres 100% Original Samsung - Foto Real,22999.9,ARS,new,107,1809987359,No Reputation,Capital Federal,https://articulo.mercadolibre.com.ar/MLA-1799083974-auriculares-manos-libres-100-original-samsung-foto-real-_JM
MLA1918157964,Auriculares In-ear Samsung Akg  Eo-ic100 Eo-ic100bbegw Negro,24999,ARS,new,22,179274188,No Reputation,Capital Federal,https://articulo.mercadolibre.com.ar/MLA-1918157964-auriculares-in-ear-samsung-akg-eo-ic100-eo-ic100bbegw-negro-_JM
MLA1450105937,Auricular Soul Tipo C Manos Libres Para S23 Ultra A14 A54 Color Blanco,8500.0,ARS,new,3,21459689,No Reputation,Capital Federal,https://articulo.mercadolibre.com.ar/MLA-1450105937-auricular-soul-tipo-c-manos-libres-para-s23-ultra-a14-a54-color-blanco-_JM
MLA1472598389,Auricular Inalambrico Samsung Galaxy Buds 2 Negro,205633,ARS,new,1,567215478,No Reputation,Buenos Aires,https://articulo.mercadolibre.com.ar/MLA-1472598389-auricular-inalambrico-samsung-galaxy-buds-2-negro-_JM
MLA1141991139,Adaptador Auriculares Tipo C Compatible Samsung S20 S21 S22,6999,ARS,new,1344,100471,No Reputation,Capital Federal,https://articulo.mercadolibre.com.ar/MLA-1141991139-adaptador-auriculares-tipo-c-compatible-samsung-s20-s21-s22-_JM
MLA1462984593,Auricular Inalambrico Pro Para Samsung iPhone Motorola J220 Color Blanco,29172.04,ARS,new,7,1118503579,No Reputation,Capital Federal,https://articulo.mercadolibre.com.ar/MLA-1462984593-auricular-inalambrico-pro-para-samsung-iphone-motorola-j220-color-blanco-_JM
MLA1798448136,Auricular 100% Original Samsung Manos Libres - Fotos Reales,22999.98,ARS,new,45,1809987359,No Reputation,Capital Federal,https://articulo.mercadolibre.com.ar/MLA-1798448136-auricular-100-original-samsung-manos-libres-fotos-reales-_JM
MLA1444021473,Auriculares Para Samsung Manos Libres A03 A13 A14 A24 A04,6999,ARS,new,100,75924141,No Reputation,Capital Federal,https://articulo.mercadolibre.com.ar/MLA-1444021473-auriculares-para-samsung-manos-libres-a03-a13-a14-a24-a04-_JM
MLA1842992702,Auriculares Stereo Usb Tipo C Compatible Con Samsung Moto Color Negro,5447,ARS,new,40,240590931,No Reputation,Buenos Aires,https://articulo.mercadolibre.com.ar/MLA-1842992702-auriculares-stereo-usb-tipo-c-compatible-con-samsung-moto-color-negro-_JM
MLA1554913250, Auriculares Para Samsung Ficha Punta Redonda 3.5mm ,4618.85,ARS,new,120,1239654169,No Reputation,Capital Federal,https://articulo.mercadolibre.com.ar/MLA-1554913250-auriculares-para-samsung-ficha-punta-redonda-35mm-_JM
MLA1183914932,Auricular Para Samsung Motorola LG Jack 3.5 Manos Libres ,4499,ARS,new,295,81219644,No Reputation,Capital Federal,https://articulo.mercadolibre.com.ar/MLA-1183914932-auricular-para-samsung-motorola-lg-jack-35-manos-libres-_JM
MLA1977336026,Auriculares Para Samsung Galaxy Buds Pro,70000,ARS,new,34,195212089,No Reputation,Capital Federal,https://articulo.mercadolibre.com.ar/MLA-1977336026-auriculares-para-samsung-galaxy-buds-pro-_JM
MLA1436064759,Auriculares In Ear Manos Libres S21+ Para Samsung Metal Sh,5590,ARS,new,68,32212593,No Reputation,Capital Federal,https://articulo.mercadolibre.com.ar/MLA-1436064759-auriculares-in-ear-manos-libres-s21-para-samsung-metal-sh-_JM
MLA1916133628,"Auriculares Tipo C Para Samsung Galaxy S23 Plus S23 M53 5g, Color Blanco",9999,ARS,new,111,1239654169,No Reputation,Capital Federal,https://articulo.mercadolibre.com.ar/MLA-1916133628-auriculares-tipo-c-para-samsung-galaxy-s23-plus-s23-m53-5g-color-blanco-_JM
MLA1611600058,Auricular Samsung Galaxy Buds 2 (compatible Con Telefonos Galaxy A Y Serie Galaxy S),824959,ARS,new,4,161008662,No Reputation,Buenos Aires,https://articulo.mercadolibre.com.ar/MLA-1611600058-auricular-samsung-galaxy-buds-2-compatible-con-telefonos-galaxy-a-y-serie-galaxy-s-_JM
MLA1449723294,Audifonos Samsung Akg Tipo C Eo-ic100bbegus S20 S21 Note 20 Color Negro,43900.0,ARS,new,76,474275915,No Reputation,Capital Federal,https://articulo.mercadolibre.com.ar/MLA-1449723294-audifonos-samsung-akg-tipo-c-eo-ic100bbegus-s20-s21-note-20-color-negro-_JM
MLA1423798707,Auriculares Tipo C Para Samsung Color Blanco Buen Sonido!!!!,6960.96,ARS,new,114,77540700,No Reputation,Capital Federal,https://articulo.mercadolibre.com.ar/MLA-1423798707-auriculares-tipo-c-para-samsung-color-blanco-buen-sonido-_JM
MLA1468456005,Auriculares In-ear Para Samsung A14 A24 A04e A12 A04 A11 A13,6999,ARS,new,69,190008349,No Reputation,Buenos Aires,https://articulo.mercadolibre.com.ar/MLA-1468456005-auriculares-in-ear-para-samsung-a14-a24-a04e-a12-a04-a11-a13-_JM
MLA1414070847,Auricular De Cable Con Micrófono Manos Libres Para Samsung ,6999,ARS,new,55,1573355060,No Reputation,Capital Federal,https://articulo.mercadolibre.com.ar/MLA-1414070847-auricular-de-cable-con-microfono-manos-libres-para-samsung-_JM
MLA1437883956,Auricular Ficha C Manos Libres Compatible Samsung Motorola ,9900,ARS,new,145,292238139,No Reputation,Capital Federal,https://articulo.mercadolibre.com.ar/MLA-1437883956-auricular-ficha-c-manos-libres-compatible-samsung-motorola-_JM
MLA1840653750,Auriculares Inalámbricos Bluetooth P/ iPhone Samsung iPad Gr Color Blanco,79942,ARS,new,3,189656161,No Reputation,Buenos Aires,https://articulo.mercadolibre.com.ar/MLA-1840653750-auriculares-inalambricos-bluetooth-p-iphone-samsung-ipad-gr-color-blanco-_JM
MLA1822016950,Auricular Compatible Samsung Motorola Xiaomi Tipo Plug 3.5mm,4999,ARS,new,21,257258141,No Reputation,Capital Federal,https://articulo.mercadolibre.com.ar/MLA-1822016950-auricular-compatible-samsung-motorola-xiaomi-tipo-plug-35mm-_JM
MLA1947367296,Auriculares Soul S589 Color Blanco Mini Plug 3.5mm,5381.0,ARS,new,39,161619180,No Reputation,Buenos Aires,https://articulo.mercadolibre.com.ar/MLA-1947367296-auriculares-soul-s589-color-blanco-mini-plug-35mm-_JM
MLA1803402692,Auricular Inalámbrico Deportivo Para Samsung A05 A15 A25 A35,37790,ARS,new,15,433051783,No Reputation,Capital Federal,https://articulo.mercadolibre.com.ar/MLA-1803402692-auricular-inalambrico-deportivo-para-samsung-a05-a15-a25-a35-_JM
MLA1974830464,Auricular Para Samsung Galaxy A55 Con Cable Entrada Usb-c,7989.94,ARS,new,103,1239654169,No Reputation,Capital Federal,https://articulo.mercadolibre.com.ar/MLA-1974830464-auricular-para-samsung-galaxy-a55-con-cable-entrada-usb-c-_JM
MLA1924293838,"Audifonos Inalámbricos Galaxy Buds3 Blanco, Ai",316999,ARS,new,18,287440338,No Reputation,Buenos Aires,https://articulo.mercadolibre.com.ar/MLA-1924293838-audifonos-inalambricos-galaxy-buds3-blanco-ai-_JM
MLA1429785839,Auricular Para Samsung J1 J2 J3 J4 J5 J6 J7 Prime Pro Plus Color Blanco,9210,ARS,new,70,180487242,No Reputation,Capital Federal,https://articulo.mercadolibre.com.ar/MLA-1429785839-auricular-para-samsung-j1-j2-j3-j4-j5-j6-j7-prime-pro-plus-color-blanco-_JM
MLA1441868523,Auriculares Baseus Encok H06 Blanco Con Control De Volúmen Jack 3.5mm Cable 1.20m,19789.0,ARS,new,1,51202728,No Reputation,Capital Federal,https://articulo.mercadolibre.com.ar/MLA-1441868523-auriculares-baseus-encok-h06-blanco-con-control-de-volumen-jack-35mm-cable-120m-_JM
MLA1447190485,Auriculares Samsung Galaxy Buds3 Color Blanco Sm-r530,349000.0,ARS,new,60,44778367,No Reputation,Capital Federal,https://articulo.mercadolibre.com.ar/MLA-1447190485-auriculares-samsung-galaxy-buds3-color-blanco-sm-r530-_JM
MLA1751843664,Auriculares Samsung Galaxy Buds2 Pro Anc Bluetooth 5.3 Ipx7 Color Bora Purple Color De La Luz Blanco,270000.0,ARS,new,30,146480022,No Reputation,Capital Federal,https://articulo.mercadolibre.com.ar/MLA-1751843664-auriculares-samsung-galaxy-buds2-pro-anc-bluetooth-53-ipx7-color-bora-purple-color-de-la-luz-blanco-_JM
MLA1434797845,Auriculares Foxbox Boost Para Motorola Samsung Manos Libres Color Negro,6600.01,ARS,new,11,331468238,No Reputation,Córdoba,https://articulo.mercadolibre.com.ar/MLA-1434797845-auriculares-foxbox-boost-para-motorola-samsung-manos-libres-color-negro-_JM
MLA1468610207,Notebook Samsung Galaxy Book3 15.6 Intel Core I3 6 Núcleos 8gb 256gb Color Silver,813473,ARS,new,1,94317526,No Reputation,Buenos Aires,https://articulo.mercadolibre.com.ar/MLA-1468610207-notebook-samsung-galaxy-book3-156-intel-core-i3-6-nucleos-8gb-256gb-color-silver-_JM
MLA1464324573,Auricular Compatible Samsung Motorola Xiaomi Tipo C Type C Color Blanco,5814,ARS,new,25,2064115616,No Reputation,Capital Federal,https://articulo.mercadolibre.com.ar/MLA-1464324573-auricular-compatible-samsung-motorola-xiaomi-tipo-c-type-c-color-blanco-_JM
MLA1181841850,Auricular Running Fitness Bluetooth Para Samsung S21 Ultra,43790.0,ARS,new,11,433051783,No Reputation,Capital Federal,https://articulo.mercadolibre.com.ar/MLA-1181841850-auricular-running-fitness-bluetooth-para-samsung-s21-ultra-_JM
MLA1333415095,Auriculares Deportivos Bluetooth Sport Para Samsung S23 5g,6330,ARS,new,858,352981908,No Reputation,Capital Federal,https://articulo.mercadolibre.com.ar/MLA-1333415095-auriculares-deportivos-bluetooth-sport-para-samsung-s23-5g-_JM
MLA1395735295,"Auriculares Compatibles Con Samsung S8, S9, S10+",3999,ARS,new,60,1459895454,No Reputation,Buenos Aires,https://articulo.mercadolibre.com.ar/MLA-1395735295-auriculares-compatibles-con-samsung-s8-s9-s10-_JM
MLA1962403110,Auriculares Tipo C Para Samsung Color Blanco,6999,ARS,new,17,84640737,No Reputation,Buenos Aires,https://articulo.mercadolibre.com.ar/MLA-1962403110-auriculares-tipo-c-para-samsung-color-blanco-_JM
MLA1463199181,Auriculares In Ear Reforzados Compatible Con Samsung,6900.0,ARS,new,60,732689126,No Reputation,Capital Federal,https://articulo.mercadolibre.com.ar/MLA-1463199181-auriculares-in-ear-reforzados-compatible-con-samsung-_JM
MLA1256878806,Auriculares Stereo Usb Tipo C Compatible Con Samsung Moto,6300.0,ARS,new,455,1382834,No Reputation,Córdoba,https://articulo.mercadolibre.com.ar/MLA-1256878806-auriculares-stereo-usb-tipo-c-compatible-con-samsung-moto-_JM
MLA1216363664,Auriculares Bluetooth Para Samsung S20 Fe S21 Fe S20 Plus,45650.0,ARS,new,346,180487242,No Reputation,Capital Federal,https://articulo.mercadolibre.com.ar/MLA-1216363664-auriculares-bluetooth-para-samsung-s20-fe-s21-fe-s20-plus-_JM
MLA1376973593,Auriculares Compatible Con Samsung Galaxy A03 Core 3.5mm,3499,ARS,new,394,27850143,No Reputation,Buenos Aires,https://articulo.mercadolibre.com.ar/MLA-1376973593-auriculares-compatible-con-samsung-galaxy-a03-core-35mm-_JM
MLA1164025078,Auricular Deportivo Running Para Samsung S20 S20plus Ultra,37790,ARS,new,62,433051783,No Reputation,Capital Federal,https://articulo.mercadolibre.com.ar/MLA-1164025078-auricular-deportivo-running-para-samsung-s20-s20plus-ultra-_JM
MLA1471579367,Auricular Inalámbrico Samsung Galaxy Buds Fe Blanco,133112,ARS,new,1,183542210,No Reputation,Buenos Aires,https://articulo.mercadolibre.com.ar/MLA-1471579367-auricular-inalambrico-samsung-galaxy-buds-fe-blanco-_JM
MLA1468428879,Auriculares Bluetooth Base Compatible Con Samsung Motorola Color Negro,18999,ARS,new,12,1167502894,No Reputation,Capital Federal,https://articulo.mercadolibre.com.ar/MLA-1468428879-auriculares-bluetooth-base-compatible-con-samsung-motorola-color-negro-_JM
MLA1457707471,Auricular Para Samsung Manos Libres Sonido Hd Tipo C,6999.0,ARS,new,75,2064115616,No Reputation,Capital Federal,https://articulo.mercadolibre.com.ar/MLA-1457707471-auricular-para-samsung-manos-libres-sonido-hd-tipo-c-_JM
MLA1465041077,Auriculares In Ear Manos Libres Sport Pace Para Samsung 3.5,7599,ARS,new,10,32212593,No Reputation,Capital Federal,https://articulo.mercadolibre.com.ar/MLA-1465041077-auriculares-in-ear-manos-libres-sport-pace-para-samsung-35-_JM
MLA1407247797,Auriculares Inalámbricos Tws Baseus Encok Wm01 De Color Blanco,34073,ARS,new,3,177592359,No Reputation,Buenos Aires,https://articulo.mercadolibre.com.ar/MLA-1407247797-auriculares-inalambricos-tws-baseus-encok-wm01-de-color-blanco-_JM
MLA1163392839,Auricular Inalámbrico Deportivo Running Para Samsung S22,37790,ARS,new,562,433051783,No Reputation,Capital Federal,https://articulo.mercadolibre.com.ar/MLA-1163392839-auricular-inalambrico-deportivo-running-para-samsung-s22-_JM
MLA1394521565,Auriculares Para Samsung Tipo C Z Flip 3 4 5  Z Fold 3 4 5  ,8900,ARS,new,104,207627249,No Reputation,Capital Federal,https://articulo.mercadolibre.com.ar/MLA-1394521565-auriculares-para-samsung-tipo-c-z-flip-3-4-5-z-fold-3-4-5-_JM
MLA1463266119,Tablet Samsung Galaxy S6 Lite 64gb 10.4 Wi-fi Processor Oc,730000,ARS,new,4,146480022,No Reputation,Capital Federal,https://articulo.mercadolibre.com.ar/MLA-1463266119-tablet-samsung-galaxy-s6-lite-64gb-104-wi-fi-processor-oc-_JM
