item_id,title,price,currency_id,condition,available_quantity,seller_id,seller_reputation,location,url
MLA1473206905,Auriculares Manos Libres Tipo C Para Samsung Galaxy S24 Fe,9999,ARS,new,50,1239654169,No Reputation,Capital Federal,https://articulo.mercadolibre.com.ar/MLA-1473206905-auriculares-manos-libres-tipo-c-para-samsung-galaxy-s24-fe-_JM
MLA1895925562,Auriculares Para Samsung Galaxy S20 Fe Conexión Tipo C,9999,ARS,new,111,1239654169,No Reputation,Capital Federal,https://articulo.mercadolibre.com.ar/MLA-1895925562-auriculares-para-samsung-galaxy-s20-fe-conexion-tipo-c-_JM
MLA1373026325,Auricular Running Fitness Bluetooth Para Samsung A24 A34 A54,43790.0,ARS,new,53,433051783,No Reputation,Capital Federal,https://articulo.mercadolibre.com.ar/MLA-1373026325-auricular-running-fitness-bluetooth-para-samsung-a24-a34-a54-_JM
MLA1842851472,Auriculares Premium Tipo C Para Samsung Z Flip 2 3 4 5 6,9390,ARS,new,9,1137959474,No Reputation,Capital Federal,https://articulo.mercadolibre.com.ar/MLA-1842851472-auriculares-premium-tipo-c-para-samsung-z-flip-2-3-4-5-6-_JM
MLA1937801586,Auricular Para Samsung Galaxy Z Fold 2 / 3 Entrada Tipo C,8999,ARS,new,70,1239654169,No Reputation,Capital Federal,https://articulo.mercadolibre.com.ar/MLA-1937801586-auricular-para-samsung-galaxy-z-fold-2-3-entrada-tipo-c-_JM
MLA1437255599,Auriculares Premium Tipo C Para Samsung A20 A30 A40 A50 A60,9390,ARS,new,8,1137959474,No Reputation,Capital Federal,https://articulo.mercadolibre.com.ar/MLA-1437255599-auriculares-premium-tipo-c-para-samsung-a20-a30-a40-a50-a60-_JM
MLA884641710,Auriculares Para Samsung J1 Ace J2 Prime J4 J5 J6 J7,5520.0,ARS,new,59,68781862,No Reputation,Capital Federal,https://articulo.mercadolibre.com.ar/MLA-884641710-auriculares-para-samsung-j1-ace-j2-prime-j4-j5-j6-j7-_JM
MLA1394510177,Auricular Tipo C Compatible Con Samsung Motorola Xiaiomi,8272.66,ARS,new,100,207627249,No Reputation,Capital Federal,https://articulo.mercadolibre.com.ar/MLA-1394510177-auricular-tipo-c-compatible-con-samsung-motorola-xiaiomi-_JM
MLA1106793753,Samsung Galaxy Buds Pro Negro Color De La Luz Gris,1507879,ARS,new,4,161008662,No Reputation,Buenos Aires,https://articulo.mercadolibre.com.ar/MLA-1106793753-samsung-galaxy-buds-pro-negro-color-de-la-luz-gris-_JM
MLA1457697223,Auricular Original Manos Libres Para Samsung,9280,ARS,new,65,2064115616,No Reputation,Capital Federal,https://articulo.mercadolibre.com.ar/MLA-1457697223-auricular-original-manos-libres-para-samsung-_JM
MLA1951381202,Auricular In-ear Inalámbricos Samsung Galaxy  Buds+ Sm-r175,195340,ARS,new,8,47756131,No Reputation,Santa Fe,https://articulo.mercadolibre.com.ar/MLA-1951381202-auricular-in-ear-inalambricos-samsung-galaxy-buds-sm-r175-_JM
MLA1949476168,Auriculares Manos Libres Soul Para Samsung iPhone Motorola Color Blanco,5381.0,ARS,new,35,51303810,No Reputation,Buenos Aires,https://articulo.mercadolibre.com.ar/MLA-1949476168-auriculares-manos-libres-soul-para-samsung-iphone-motorola-color-blanco-_JM
MLA1437987807,Auricular Bluetooth Vincha Running Para Samsung A53 A54 A55,19790,ARS,new,6,433051783,No Reputation,Capital Federal,https://articulo.mercadolibre.com.ar/MLA-1437987807-auricular-bluetooth-vincha-running-para-samsung-a53-a54-a55-_JM
MLA1424150199,Auriculares Tipo C Compatible Samsung S21 S22 S23 S24 ,6002,ARS,new,200,77540700,No Reputation,Capital Federal,https://articulo.mercadolibre.com.ar/MLA-1424150199-auriculares-tipo-c-compatible-samsung-s21-s22-s23-s24-_JM
MLA1471728543,Auriculares Con Micrófono Manos Libres Para Samsung,6999,ARS,new,20,456333202,No Reputation,Buenos Aires,https://articulo.mercadolibre.com.ar/MLA-1471728543-auriculares-con-microfono-manos-libres-para-samsung-_JM
MLA1842939858,Auriculares Premium Tipo C Para Samsung A05 A06 A15 A16,9390,ARS,new,8,1137959474,No Reputation,Capital Federal,https://articulo.mercadolibre.com.ar/MLA-1842939858-auriculares-premium-tipo-c-para-samsung-a05-a06-a15-a16-_JM
MLA1554645792,Auriculares Cable Para Samsung Galaxy A54 5g Entrada Usb C,9999,ARS,new,104,1239654169,No Reputation,Capital Federal,https://articulo.mercadolibre.com.ar/MLA-1554645792-auriculares-cable-para-samsung-galaxy-a54-5g-entrada-usb-c-_JM
MLA1866917046,Auriculares Samsung By Akg 3.5mm Originales Negros,31999,ARS,new,16,293421646,No Reputation,Buenos Aires,https://articulo.mercadolibre.com.ar/MLA-1866917046-auriculares-samsung-by-akg-35mm-originales-negros-_JM
MLA1394439477,Auriculares Cable Para Samsung Galaxy A34 Entrada Usb C,9999,ARS,new,139,1239654169,No Reputation,Capital Federal,https://articulo.mercadolibre.com.ar/MLA-1394439477-auriculares-cable-para-samsung-galaxy-a34-entrada-usb-c-_JM
MLA1390190263,Auricular Soul S589 Tipo C Compatible Con Samsung Motorola,7456.0,ARS,new,30,161619180,No Reputation,Buenos Aires,https://articulo.mercadolibre.com.ar/MLA-1390190263-auricular-soul-s589-tipo-c-compatible-con-samsung-motorola-_JM
MLA1381373627,Auriculares Tipo C Para Samsung S20fe S20 S21 Note 20 A33 ,8119,ARS,new,38,1167502894,No Reputation,Capital Federal,https://articulo.mercadolibre.com.ar/MLA-1381373627-auriculares-tipo-c-para-samsung-s20fe-s20-s21-note-20-a33-_JM
MLA1436142555,Auriculares Deportivos Running Para Samsung Z Flip 5 / Fold5,21390,ARS,new,4,433051783,No Reputation,Capital Federal,https://articulo.mercadolibre.com.ar/MLA-1436142555-auriculares-deportivos-running-para-samsung-z-flip-5-fold5-_JM
MLA1356368598,Auricular Inalámbrico Deportivo Running Para Samsung S23,37790,ARS,new,62,433051783,No Reputation,Capital Federal,https://articulo.mercadolibre.com.ar/MLA-1356368598-auricular-inalambrico-deportivo-running-para-samsung-s23-_JM
MLA1942621588,Auriculares Manos Libres Para Samsung Sin Goma 100% Garantía,6292.0,ARS,new,97,827087111,No Reputation,Buenos Aires,https://articulo.mercadolibre.com.ar/MLA-1942621588-auriculares-manos-libres-para-samsung-sin-goma-100-garantia-_JM
MLA1669104070,Auriculares Para Samsung A53 A73 S21 A33 S22 S10 A52 A51 A22,16999,ARS,new,10,1398457875,No Reputation,Capital Federal,https://articulo.mercadolibre.com.ar/MLA-1669104070-auriculares-para-samsung-a53-a73-s21-a33-s22-s10-a52-a51-a22-_JM
MLA1362492457,Auricular Inalámbrico Táctil Para Samsung A50 A51 A52 A53,23790.0,ARS,new,21,1137959474,No Reputation,Capital Federal,https://articulo.mercadolibre.com.ar/MLA-1362492457-auricular-inalambrico-tactil-para-samsung-a50-a51-a52-a53-_JM
MLA1989974816,Notebook Samsung Galaxy Book3 15.6 Intel Core I5 8gb 512gb,1222999,ARS,new,10,666749750,No Reputation,Capital Federal,https://articulo.mercadolibre.com.ar/MLA-1989974816-notebook-samsung-galaxy-book3-156-intel-core-i5-8gb-512gb-_JM
MLA1436181505,Auriculares Deportivos Running Para Samsung S24/ Plus/ Ultra,21390,ARS,new,4,433051783,No Reputation,Capital Federal,https://articulo.mercadolibre.com.ar/MLA-1436181505-auriculares-deportivos-running-para-samsung-s24-plus-ultra-_JM
MLA1147419099,Auriculares Manos Libres Compatible Samsung A20 30 A50 A70,6599,ARS,new,53,11492104,No Reputation,Capital Federal,https://articulo.mercadolibre.com.ar/MLA-1147419099-auriculares-manos-libres-compatible-samsung-a20-30-a50-a70-_JM
MLA1469453649,Auriculares Bluetooth 5.2 Tws Para iPhone Xiaomi Samsung Color Rosa,29990,ARS,new,3,284824585,No Reputation,Capital Federal,https://articulo.mercadolibre.com.ar/MLA-1469453649-auriculares-bluetooth-52-tws-para-iphone-xiaomi-samsung-color-rosa-_JM
MLA1436155025,Auriculares Deportivos Running Para Samsung A14 A24 A34 A54,21390,ARS,new,4,433051783,No Reputation,Capital Federal,https://articulo.mercadolibre.com.ar/MLA-1436155025-auriculares-deportivos-running-para-samsung-a14-a24-a34-a54-_JM
MLA1147199858,Auriculares Con Cable Para Samsung A22 A52 A32 A72 A02s,5529.0,ARS,new,416,11492104,No Reputation,Capital Federal,https://articulo.mercadolibre.com.ar/MLA-1147199858-auriculares-con-cable-para-samsung-a22-a52-a32-a72-a02s-_JM
MLA879279197,Auriculares Para Samsung J4 J4 J6 J6 J8 + Plus ,8249,ARS,new,26,68781862,No Reputation,Capital Federal,https://articulo.mercadolibre.com.ar/MLA-879279197-auriculares-para-samsung-j4-j4-j6-j6-j8-plus-_JM
MLA1412891063,Auriculares Para Samsung Galaxy A24 Entrada Ficha Tipo C,7698.9,ARS,new,10,1239654169,No Reputation,Capital Federal,https://articulo.mercadolibre.com.ar/MLA-1412891063-auriculares-para-samsung-galaxy-a24-entrada-ficha-tipo-c-_JM
MLA1784034416,Auricular Para Samsung Galaxy S23/s23 Ultra Tipo C X 2 Unid,17999,ARS,new,11,1239654169,No Reputation,Capital Federal,https://articulo.mercadolibre.com.ar/MLA-1784034416-auricular-para-samsung-galaxy-s23s23-ultra-tipo-c-x-2-unid-_JM
MLA1449467113,Auriculares Inalámbrico Touch Deportivo Para Samsung A53 A54,21390,ARS,new,20,1398457875,No Reputation,Capital Federal,https://articulo.mercadolibre.com.ar/MLA-1449467113-auriculares-inalambrico-touch-deportivo-para-samsung-a53-a54-_JM
MLA1914183396,Auriculares Ficha Tipo C Para Samsung Galaxy S24 Ultra,9999,ARS,new,443,1239654169,No Reputation,Capital Federal,https://articulo.mercadolibre.com.ar/MLA-1914183396-auriculares-ficha-tipo-c-para-samsung-galaxy-s24-ultra-_JM
MLA1679531658,Auricularse Compatible Samsung S21 A33 A53 A54 S23 Tipo C,9999,ARS,new,128,1239654169,No Reputation,Capital Federal,https://articulo.mercadolibre.com.ar/MLA-1679531658-auricularse-compatible-samsung-s21-a33-a53-a54-s23-tipo-c-_JM
MLA1441930028,Auricular Inalámbrico Deportivo Para Samsung A13 A23 A33 A53,37790,ARS,new,34,433051783,No Reputation,Capital Federal,https://articulo.mercadolibre.com.ar/MLA-1441930028-auricular-inalambrico-deportivo-para-samsung-a13-a23-a33-a53-_JM
MLA1408950881,Auriculares Manos Libres Tipo C Para Samsung A22 A53 A52 S21,16999,ARS,new,5,1398457875,No Reputation,Capital Federal,https://articulo.mercadolibre.com.ar/MLA-1408950881-auriculares-manos-libres-tipo-c-para-samsung-a22-a53-a52-s21-_JM
MLA1436207125,Auriculares Deportivos Running Para Samsung A13 A23 A33 A53,21390,ARS,new,9,433051783,No Reputation,Capital Federal,https://articulo.mercadolibre.com.ar/MLA-1436207125-auriculares-deportivos-running-para-samsung-a13-a23-a33-a53-_JM
MLA1880488224,Auriculares Qcy Pro Manos Libres Bluetooth Samsung LG Sony Color Negro,25999,ARS,new,10024,37133205,No Reputation,Capital Federal,https://articulo.mercadolibre.com.ar/MLA-1880488224-auriculares-qcy-pro-manos-libres-bluetooth-samsung-lg-sony-color-negro-_JM
MLA1141660946,Auriculares Para Xiaomi LG Samsung iPhone Manos Libres,9210.0,ARS,new,515,180487242,No Reputation,Capital Federal,https://articulo.mercadolibre.com.ar/MLA-1141660946-auriculares-para-xiaomi-lg-samsung-iphone-manos-libres-_JM
MLA923084363,Auricular Para Samsung Motorola LG Manos Libres ,14999,ARS,new,626,81219644,No Reputation,Capital Federal,https://articulo.mercadolibre.com.ar/MLA-923084363-auricular-para-samsung-motorola-lg-manos-libres-_JM
MLA1970437480,Auriculares Inalámbricos Noga Aris  Ng-a100bt Ng-a100bt Azul,22800,ARS,new,2,47260238,No Reputation,Buenos Aires,https://articulo.mercadolibre.com.ar/MLA-1970437480-auriculares-inalambricos-noga-aris-ng-a100bt-ng-a100bt-azul-_JM
MLA1183914932,Auricular Para Samsung Motorola LG Jack 3.5 Manos Libres ,4499,ARS,new,295,81219644,No Reputation,Capital Federal,https://articulo.mercadolibre.com.ar/MLA-1183914932-auricular-para-samsung-motorola-lg-jack-35-manos-libres-_JM
MLA1369143029,Auricular Para Samsung Motorola LG Manos Libres Jack 3.5,4999,ARS,new,381,81219644,No Reputation,Capital Federal,https://articulo.mercadolibre.com.ar/MLA-1369143029-auricular-para-samsung-motorola-lg-manos-libres-jack-35-_JM
MLA1108327812,Auricular Manos Libre Iglufive I5 Blanco Compatible LG,3504,ARS,new,19,227445377,No Reputation,Buenos Aires,https://articulo.mercadolibre.com.ar/MLA-1108327812-auricular-manos-libre-iglufive-i5-blanco-compatible-lg-_JM
MLA1118543837,Auricular Manos Libre Iglufive I5 Blanco Compatible LG,3504,ARS,new,8,227130135,No Reputation,Buenos Aires,https://articulo.mercadolibre.com.ar/MLA-1118543837-auricular-manos-libre-iglufive-i5-blanco-compatible-lg-_JM
MLA1119621334,Auricular Alcatel Original Manos Libres 100% Original LG Zte,11931,ARS,new,4,801935460,No Reputation,Capital Federal,https://articulo.mercadolibre.com.ar/MLA-1119621334-auricular-alcatel-original-manos-libres-100-original-lg-zte-_JM
MLA1473750973,Auriculares Baseus Encok H06 3.5mm Cableado Color Negro,19990,ARS,new,1,284824585,No Reputation,Capital Federal,https://articulo.mercadolibre.com.ar/MLA-1473750973-auriculares-baseus-encok-h06-35mm-cableado-color-negro-_JM
MLA763101696,Auriculares LG 100% Original,6000,ARS,new,85,35758687,No Reputation,Buenos Aires,https://articulo.mercadolibre.com.ar/MLA-763101696-auriculares-lg-100-original-_JM
MLA1118569659,Auricular Compatible Con Igoodlo 3.5mm Mp3 Mp4 LG,1992,ARS,new,6,227130135,No Reputation,Buenos Aires,https://articulo.mercadolibre.com.ar/MLA-1118569659-auricular-compatible-con-igoodlo-35mm-mp3-mp4-lg-_JM
MLA1126715007,Placa De Carga Para LG K61 (mic+auricular+pin) Carga Rápida,6690,ARS,new,9,773536762,No Reputation,Buenos Aires,https://articulo.mercadolibre.com.ar/MLA-1126715007-placa-de-carga-para-lg-k61-micauricularpin-carga-rapida-_JM
MLA1141986502,Auricular In Ear 3.5mm Mp3 Compatible LG,1992,ARS,new,1,227130135,No Reputation,Buenos Aires,https://articulo.mercadolibre.com.ar/MLA-1141986502-auricular-in-ear-35mm-mp3-compatible-lg-_JM
MLA1108145716,Auricular Compatible Con Igoodlo LG 3.5mm Mp3 Mp4 ,1992,ARS,new,26,227445377,No Reputation,Buenos Aires,https://articulo.mercadolibre.com.ar/MLA-1108145716-auricular-compatible-con-igoodlo-lg-35mm-mp3-mp4-_JM
MLA1848642086,LG Tone Free True Wireless Bluetooth Fp9 Auriculares Con De Color Negro Color De La Luz No Aplica,290396,ARS,new,10,96243585,No Reputation,Buenos Aires,https://articulo.mercadolibre.com.ar/MLA-1848642086-lg-tone-free-true-wireless-bluetooth-fp9-auriculares-con-de-color-negro-color-de-la-luz-no-aplica-_JM
MLA627632624,Dongle Bluetoth Transmisor Usb P/ Televisores LG Sony Samsung Smart Tv Auriculares En Tu Tv Sin Cables,13830,ARS,new,1989,167165651,No Reputation,Capital Federal,https://articulo.mercadolibre.com.ar/MLA-627632624-dongle-bluetoth-transmisor-usb-p-televisores-lg-sony-samsung-smart-tv-auriculares-en-tu-tv-sin-cables-_JM
MLA1836987884,Auriculares Stereo Tipo C Premium Para Modelos LG,8990,ARS,new,4,1137959474,No Reputation,Capital Federal,https://articulo.mercadolibre.com.ar/MLA-1836987884-auriculares-stereo-tipo-c-premium-para-modelos-lg-_JM
MLA1438052019,Auricular Bluetooth Vincha Running Para Modelos LG,19790,ARS,new,6,433051783,No Reputation,Capital Federal,https://articulo.mercadolibre.com.ar/MLA-1438052019-auricular-bluetooth-vincha-running-para-modelos-lg-_JM
MLA1978195188,"Audífonos LG Tone-fp9 Inalámbricos, Con Cancelación De Ruido",136117.22,ARS,new,9,2153421531,No Reputation,Florida,https://articulo.mercadolibre.com.ar/MLA-1978195188-audifonos-lg-tone-fp9-inalambricos-con-cancelacion-de-ruido-_JM
MLA1978122320,Auriculares LG Tone Free True Wireless Bluetooth Fp9 Con Fun,186701.45,ARS,new,20,2156249700,No Reputation,Florida,https://articulo.mercadolibre.com.ar/MLA-1978122320-auriculares-lg-tone-free-true-wireless-bluetooth-fp9-con-fun-_JM
MLA1384456030,Auricular Manos Libres LG 3.5mm Ear Headset,22931,ARS,new,4,801935460,No Reputation,Capital Federal,https://articulo.mercadolibre.com.ar/MLA-1384456030-auricular-manos-libres-lg-35mm-ear-headset-_JM
MLA1880583598,Kit Limpieza Celular Auriculares Cámara Microcentro,7734.0,ARS,new,8,61210985,No Reputation,Capital Federal,https://articulo.mercadolibre.com.ar/MLA-1880583598-kit-limpieza-celular-auriculares-camara-microcentro-_JM
MLA1465967011,Lilgadgets Connect+ Auriculares Con Cable Para Niños Para La,80109.92,ARS,new,100,2153420129,No Reputation,Florida,https://articulo.mercadolibre.com.ar/MLA-1465967011-lilgadgets-connect-auriculares-con-cable-para-ninos-para-la-_JM
MLA1978170858,"Auriculares LG Tono-fp5, Negro/bluetooth/microfonos",135521.92,ARS,new,10,2156221828,No Reputation,Florida,https://articulo.mercadolibre.com.ar/MLA-1978170858-auriculares-lg-tono-fp5-negrobluetoothmicrofonos-_JM
MLA1118123003,Auricular Celular Compatible LG,1992,ARS,new,5,227130135,No Reputation,Buenos Aires,https://articulo.mercadolibre.com.ar/MLA-1118123003-auricular-celular-compatible-lg-_JM
MLA1465965883,"Philmore Crystal Radio Auricular A Cable Pelado Y Estañado,",54196.11,ARS,new,98,2151936946,No Reputation,Florida,https://articulo.mercadolibre.com.ar/MLA-1465965883-philmore-crystal-radio-auricular-a-cable-pelado-y-estanado-_JM
MLA1460795127,Audífonos LG Tone Flex Bluetooth Meridian Stereo Hbs-xl7 Azu Color Azul,805599,ARS,new,100,1344922108,No Reputation,Capital Federal,https://articulo.mercadolibre.com.ar/MLA-1460795127-audifonos-lg-tone-flex-bluetooth-meridian-stereo-hbs-xl7-azu-color-azul-_JM
MLA1438989517,Oem Urbanx Auriculares Estéreo Con Cable Motorola One 5g Ace,68901,ARS,new,10,96243585,No Reputation,Buenos Aires,https://articulo.mercadolibre.com.ar/MLA-1438989517-oem-urbanx-auriculares-estereo-con-cable-motorola-one-5g-ace-_JM
MLA1979276560,"Almohadillas Klipsch Para Auriculares, Grande/transparente",82326.41,ARS,new,10,2156221828,No Reputation,Florida,https://articulo.mercadolibre.com.ar/MLA-1979276560-almohadillas-klipsch-para-auriculares-grandetransparente-_JM
MLA1443813123,LG Tonefree Fp5 Audífonos Bluetooth Con Cancelación De Ruido,226499,ARS,new,10,96243585,No Reputation,Buenos Aires,https://articulo.mercadolibre.com.ar/MLA-1443813123-lg-tonefree-fp5-audifonos-bluetooth-con-cancelacion-de-ruido-_JM
MLA1413047946,LG Tone Free True Wireless Bluetooth Earbuds Fp5 Cancelación,240699,ARS,new,101,568588035,No Reputation,Capital Federal,https://articulo.mercadolibre.com.ar/MLA-1413047946-lg-tone-free-true-wireless-bluetooth-earbuds-fp5-cancelacion-_JM
MLA1465731681,Audifonos Inalambricos Bluetooth Estéreo LG Tone Flex Hbs-,311573.78,ARS,new,10,2156221828,No Reputation,Florida,https://articulo.mercadolibre.com.ar/MLA-1465731681-audifonos-inalambricos-bluetooth-estereo-lg-tone-flex-hbs--_JM
MLA1318922778,Auriculares Bluetooth Inalámbricos LG Hbs-fn6w True Negros,526719,ARS,new,4,161008662,No Reputation,Buenos Aires,https://articulo.mercadolibre.com.ar/MLA-1318922778-auriculares-bluetooth-inalambricos-lg-hbs-fn6w-true-negros-_JM
MLA1379636109,LG Tone Flex Hbs-xl7 Auriculares Estereo Inalambricos Blue,678999,ARS,new,100,568588035,No Reputation,Capital Federal,https://articulo.mercadolibre.com.ar/MLA-1379636109-lg-tone-flex-hbs-xl7-auriculares-estereo-inalambricos-blue-_JM
MLA866518724,Adaptador De Auriculares Usb C A Jack 3.5 Mm Moto Xiaomi LG,14998.99,ARS,new,200,129647735,No Reputation,Capital Federal,https://articulo.mercadolibre.com.ar/MLA-866518724-adaptador-de-auriculares-usb-c-a-jack-35-mm-moto-xiaomi-lg-_JM
MLA1619203908,Soporte De Auriculares Impreso En 3d - Los Gordos Pop,13200,ARS,new,300,1492399416,No Reputation,Capital Federal,https://articulo.mercadolibre.com.ar/MLA-1619203908-soporte-de-auriculares-impreso-en-3d-los-gordos-pop-_JM
MLA1978602386,"Auricular Bluetooth Heibas G7, Monoaural, Liviano, Color Neg",82541.72,ARS,new,100,2153421531,No Reputation,Florida,https://articulo.mercadolibre.com.ar/MLA-1978602386-auricular-bluetooth-heibas-g7-monoaural-liviano-color-neg-_JM
MLA1379543741,Auriculares Bluetooth LG Tone Free Hbs-fn4 Originales,438299,ARS,new,100,568588035,No Reputation,Capital Federal,https://articulo.mercadolibre.com.ar/MLA-1379543741-auriculares-bluetooth-lg-tone-free-hbs-fn4-originales-_JM
MLA870262180,Auriculares In Ear True Wireless LG Tone Free Hbs-fn4 Negro ,607319,ARS,new,4,161008662,No Reputation,Buenos Aires,https://articulo.mercadolibre.com.ar/MLA-870262180-auriculares-in-ear-true-wireless-lg-tone-free-hbs-fn4-negro-_JM
MLA783328557,Auriculares 100% Original Baseus Encok H06 3.5mm In-ear Para Samsung Huawei Xiaomi LG Moto,34999.01,ARS,new,164,129647735,No Reputation,Capital Federal,https://articulo.mercadolibre.com.ar/MLA-783328557-auriculares-100-original-baseus-encok-h06-35mm-in-ear-para-samsung-huawei-xiaomi-lg-moto-_JM
MLA1265721868,Parlante Auricular Interno Compatible Con LG K10 2017 M50ar,1993.29,ARS,new,101,82531179,No Reputation,Capital Federal,https://articulo.mercadolibre.com.ar/MLA-1265721868-parlante-auricular-interno-compatible-con-lg-k10-2017-m50ar-_JM
MLA1504504686,Audífonos Inalámbricos LG Tone Free Fit Tf7 Bluetooth,522099,ARS,new,100,568588035,No Reputation,Capital Federal,https://articulo.mercadolibre.com.ar/MLA-1504504686-audifonos-inalambricos-lg-tone-free-fit-tf7-bluetooth-_JM
MLA1866839968,Vekeff Almohadillas De Repuesto G733 Funda De Cojín Con Para,95699,ARS,new,100,1344922108,No Reputation,Capital Federal,https://articulo.mercadolibre.com.ar/MLA-1866839968-vekeff-almohadillas-de-repuesto-g733-funda-de-cojin-con-para-_JM
MLA1390231539,LG Tone Free Fn5w Auriculares Bluetooth Inalámbricos Con Con Color Negro,481999,ARS,new,100,568588035,No Reputation,Capital Federal,https://articulo.mercadolibre.com.ar/MLA-1390231539-lg-tone-free-fn5w-auriculares-bluetooth-inalambricos-con-con-color-negro-_JM
MLA1440271613,Producto Generico - LG Tone Free T90 - Auriculares Bluetoot. Color Negro,673999,ARS,new,100,1344922108,No Reputation,Capital Federal,https://articulo.mercadolibre.com.ar/MLA-1440271613-producto-generico-lg-tone-free-t90-auriculares-bluetoot-color-negro-_JM
MLA1112667209,Auriculares LG Tone  Free Fp9  Inalambricos (color Negro),424809,ARS,new,6,161008662,No Reputation,Buenos Aires,https://articulo.mercadolibre.com.ar/MLA-1112667209-auriculares-lg-tone-free-fp9-inalambricos-color-negro-_JM
MLA1400218739,Adaptador Tipo C A Jack Mini Plug Aux 3.5m Audio Auriculares,5487,ARS,new,20,238562150,No Reputation,Capital Federal,https://articulo.mercadolibre.com.ar/MLA-1400218739-adaptador-tipo-c-a-jack-mini-plug-aux-35m-audio-auriculares-_JM
MLA1980807900,Auriculares Estéreo Inalámbricos Bluetooth Con Banda Para El,308245.38,ARS,new,30,2156249700,No Reputation,Florida,https://articulo.mercadolibre.com.ar/MLA-1980807900-auriculares-estereo-inalambricos-bluetooth-con-banda-para-el-_JM
MLA1508207398,LG Tone Free True Wireless Bluetooth Earbuds T90 Auriculares Color Negro,453599,ARS,new,100,568588035,No Reputation,Capital Federal,https://articulo.mercadolibre.com.ar/MLA-1508207398-lg-tone-free-true-wireless-bluetooth-earbuds-t90-auriculares-color-negro-_JM
MLA1980702880,Auriculares Estéreo Inalámbricos Bluetooth Con Banda Para El,308245.38,ARS,new,30,2148180470,No Reputation,Florida,https://articulo.mercadolibre.com.ar/MLA-1980702880-auriculares-estereo-inalambricos-bluetooth-con-banda-para-el-_JM
MLA1465555459,"Audio Bluetooth Heibas G7, Monoaural, Liviano, Color Ne...",97525.12,ARS,new,10,2156221828,No Reputation,Florida,https://articulo.mercadolibre.com.ar/MLA-1465555459-audio-bluetooth-heibas-g7-monoaural-liviano-color-ne-_JM
MLA1467615099,Auriculares LG Tone Free True Wireless Bluetooth Fp9 Con Fun,186701.47,ARS,new,20,2148180470,No Reputation,Florida,https://articulo.mercadolibre.com.ar/MLA-1467615099-auriculares-lg-tone-free-true-wireless-bluetooth-fp9-con-fun-_JM
MLA1440501645,Auriculares Con Cable Hifi Con Aislamiento Ruido Auriculares,42388,ARS,new,100,1344922108,No Reputation,Capital Federal,https://articulo.mercadolibre.com.ar/MLA-1440501645-auriculares-con-cable-hifi-con-aislamiento-ruido-auriculares-_JM
MLA1978199492,Auriculares Bluetooth LG Tone Free T90 Con Anc Dolby Atmos N,265642.38,ARS,new,30,2148180470,No Reputation,Florida,https://articulo.mercadolibre.com.ar/MLA-1978199492-auriculares-bluetooth-lg-tone-free-t90-con-anc-dolby-atmos-n-_JM
MLA1438358029,Lilgadgets Connect+ - Auriculares Con Cable Para Nios Con Mi,140999,ARS,new,100,1344922108,No Reputation,Capital Federal,https://articulo.mercadolibre.com.ar/MLA-1438358029-lilgadgets-connect-auriculares-con-cable-para-nios-con-mi-_JM
MLA1978108894,Auriculares Bluetooth LG Tone Free T90 Con Anc Dolby Atmos N,265642.38,ARS,new,30,2156249700,No Reputation,Florida,https://articulo.mercadolibre.com.ar/MLA-1978108894-auriculares-bluetooth-lg-tone-free-t90-con-anc-dolby-atmos-n-_JM
MLA1135369510,Funda Antigolpe Para LG K50s Reforzada Microcentro,8846.4,ARS,new,19,61210985,No Reputation,Capital Federal,https://articulo.mercadolibre.com.ar/MLA-1135369510-funda-antigolpe-para-lg-k50s-reforzada-microcentro-_JM
MLA1515157846,Auriculares De Forro Polar Para Dormir Con Bolsa-negros,95979,ARS,new,4,161008662,No Reputation,Buenos Aires,https://articulo.mercadolibre.com.ar/MLA-1515157846-auriculares-de-forro-polar-para-dormir-con-bolsa-negros-_JM
MLA1132766235,Auricular Manos Libres LG Sgey0003213 Para Ficha Kg800 Kp570,5000,ARS,new,1,157761264,No Reputation,Neuquén,https://articulo.mercadolibre.com.ar/MLA-1132766235-auricular-manos-libres-lg-sgey0003213-para-ficha-kg800-kp570-_JM
MLA870262899,Auriculares In Ear True Wireless LG Tone Free Hbs-fn5w Negro,667629,ARS,new,5,161008662,No Reputation,Buenos Aires,https://articulo.mercadolibre.com.ar/MLA-870262899-auriculares-in-ear-true-wireless-lg-tone-free-hbs-fn5w-negro-_JM
MLA1387519013,Auriculares In Ear True Wireless LG Tone Free Hbs-fn4 Color Blanco,638439,ARS,new,4,161008662,No Reputation,Buenos Aires,https://articulo.mercadolibre.com.ar/MLA-1387519013-auriculares-in-ear-true-wireless-lg-tone-free-hbs-fn4-color-blanco-_JM
MLA911796637,Auriculares Earbuds Inalam. LG Black  Bd906 ,909959,ARS,new,5,161008662,No Reputation,Buenos Aires,https://articulo.mercadolibre.com.ar/MLA-911796637-auriculares-earbuds-inalam-lg-black-bd906-_JM
MLA1667665180,LG Tone Free Fn7 - Auriculares Inalámbricos Bluetooth Con Ca,731889,ARS,new,6,161008662,No Reputation,Buenos Aires,https://articulo.mercadolibre.com.ar/MLA-1667665180-lg-tone-free-fn7-auriculares-inalambricos-bluetooth-con-ca-_JM
MLA1729375748,Vr Box Para Celular+joystick Remoto+auricular Vrbox+gratis,76999,ARS,new,11,2014661,No Reputation,Buenos Aires,https://articulo.mercadolibre.com.ar/MLA-1729375748-vr-box-para-celularjoystick-remotoauricular-vrboxgratis-_JM
